{
  "patient": {
    "id": "P008",
    "name": "Lisa Demo",
    "age": 68,
    "sex": "female"
  },
  "medications": [
    {
      "name": "Lisinopril",
      "rxCui": "29046",
      "dosage": "20 mg once daily"
    },
    {
      "name": "Ibuprofen",
      "rxCui": "5640",
      "dosage": "400 mg every 8 hours as needed"
    }
  ],
  "labs": [
    {
      "name": "Potassium",
      "loinc": "2823-3",
      "value": 5.9,
      "unit": "mmol/L",
      "interpretation": "H",
      "effectiveDate": "2026-09-18"
    },
    {
      "name": "eGFR",
      "loinc": "98979-8",
      "value": 48,
      "unit": "mL/min/{1.73_m2}",
      "interpretation": "L",
      "effectiveDate": "2026-09-18"
    }
  ],
  "documents": [
    {
      "id": "DOC-P008-01",
      "type": "Discharge Summary",
      "date": "2026-09-18"
    }
  ]
}
